<?xml version="1.0" encoding="UTF-8"?>
<email
xmlns:xsi="http://www.w3.org/2001/XMLSchema-instance"
xsi:noNamespaceSchemaLocation="myemail.xsd"
id="email001">
    <header>
        <from email="john.doe@example.com">John Doe</from>
        <to email="jane.doe@example.com">Jane Doe</to>
        <subject>Meeting Reminder</subject>
        <date>2024-09-25</date>
    </header>
    <body>
        This is a reminder for our meeting scheduled tomorrow at 10 AM.
    </body>
    <attachments>
        <attachment size="2MB">
            <filename>meeting_agenda.pdf</filename>
            <filetype>application/pdf</filetype>
        </attachment>
    </attachments>
</email>